index,url,nom_produit,img_produit,prix_produit,contenance,pg_vg,origine,frais,surbooste,saveur,description,brand,gout,info_brand,id_produit
24,https://www.aromes-et-liquides.fr/e-liquide-biggy-bear/16210-pomme-cerise-bubble-gum-200ml.html,Pomme Cerise Bubble Gum 200ml Biggy Bear,https://assets.aromes-et-liquides.fr/50457-thickbox_default/pomme-cerise-bubble-gum-200ml.jpg,14.5,200ml,50/50,France,Oui,Oui,"lime, kiwi, fraise, popcorn, grenade, cerise, pomme, bubble gum","Fabriqué en France par Secret's Lab, le e-liquide pour cigarette électronique Pomme Cerise Bubble Gum est issu de la collection Biggy Bear. Composé d'arômes alimentaires, de propylène glycol (PG) et de glycérine végétale (VG), il vous est proposé dans un ratio50PG/50VG. Sarecette fraîchenon nicotinée de base peut au besoin être additionnée de boosters (non inclus), ceci en vous munissant d'un flacon vide pour réaliser votre mélange. Son flacon de 200ml est équipé d'un bouchon avec protection enfant et d'un embout fin. Qui est Secret's Lab ? Ce fabricant français élabore toutes ses recettes pour cigarettes électroniques dans ses laboratoires situés à Marseille. Secret's Lab est notamment le créateur de gammes de renommées, telles que Secret Keys, Secret Garden, ou encore Biggy Bear. La gamme Biggy Bear La collection mythique à l'effigie d'un ours en peluche est issue de l'imagination des aromaticiens français de Secret's Lab. Retrouvez une gamme de recettes variées, disponibles en format e-liquides ou arômes DIY. Du mix fruité au popcorn caramélisé, vous trouverez sans nul doute la saveur qui vous convient parmi cette vaste collection. Comment préparer votre e-liquide Pomme Cerise Bubble Gum ? Le Grenade Fraise Kiwi est proposé en version200mlboostée en arômes. Si vous le souhaitez, vous pouvez ainsi ajouter un ou plusieurs boosters de nicotine selon vos besoins sans perte de saveur. Pour booster votre e-liquide, vous devez : Indications pour préparer votre e-liquide surboosté de 100 ml : La place disponible dans le flacon d'origine n’est peut-être pas suffisante pour booster votre e-liquide au taux de nicotine souhaité. Pour les dosages importants, nous vous conseillons l’utilisation de contenants plus importants commeun flacon de 100ml graduéouun flacon Twist de 230ml gradué. Astuce : pensez à adapter votre matériel au ratio PG/VG de votre e-liquide ! Vous limiterez ainsi le risque de fuite et l’usure prématurée de vos résistances ! Quel taux de nicotine choisir pour votre e-liquide ? Le choix de votre taux de nicotine dépend de votre profil de fumeur ainsi que de la cigarette électronique utilisée : Si vous utilisez du matériel plus performant avec une résistance inférieure à 1 ohm et pour une puissance supérieure à 30 watts, vous pouvez diviser votre taux de nicotine par deux. Nos conseils pour la maturation de votre e-liquide surboosté De la même façon que pour un e-liquide DIY, on peut observer un temps de repos avec un e-liquide surboosté en arômes après l’ajout d’un ou plusieurs boosters de nicotine. Ce temps de maturation que l’on appelle aussi “steep” permet aux arômes de se développer et de mieux s’exprimer. Pour une maturation optimale, il faut compter : Pour un rendu optimal : secouez votre fiole de e-liquide une fois par jour pour que les arômes se diffusent correctement. Conservation de votre e-liquide Pour une conservation optimale de votre e-liquide, nous vous conseillons de stocker votre flacon à l'abri de la lumière dans un droit sec et à température ambiante. Après contacts répétés à l'air et à la lumière, la couleur de votre e-liquide peut se foncer. Ce changement de couleur n'affecte ni la qualité ni le goût de votre e-liquide. La date indiquée sur l'étiquette est une DLUO (date limite d'utilisation optimale) ou DDM (date de durabilité minimale). Passé cette date, le e-liquide peut encore être consommé.",Secret's Lab,fruit,"Ce fabricant français élabore toutes ses recettes pour cigarettes électroniques dans ses laboratoires situés à Marseille. Secret's Lab est notamment le créateur de gammes de renommées, telles que Secret Keys, Secret Garden, ou encore Biggy Bear.",25
25,https://www.aromes-et-liquides.fr/e-liquide-vampire-vape/3532-e-liquide-pinkman-par-vampire-vape.html,Pinkman Vampire Vape,https://assets.aromes-et-liquides.fr/53591-thickbox_default/e-liquide-pinkman-par-vampire-vape.jpg,5.5,10ml,60/40,Royaume-Uni,Non,Non,"orange, parfait, citron, pamplemousse, lime, agrumes","Le Pinkman est un e-liquide pour cigarette électronique d'origine anglaise, signé Vampire Vape. Présenté en petit flacon 10ml, ce produit estprêt à l'emploi: il est déjà parfaitement aromatisé, dosé et nicotiné (plusieurs taux au choix) et propose une saveur d'agrumes. Qu'est-ce que le e-liquide Pinkman par Vampire Vape ? Le Pinkman est un e-liquide pour e-cigaretteprêt à vaper. Conforme à la loi TPD, il présente déjà de la nicotine dans son flacon (sauf pour sa version en 0 mg/ml). Recette incontournable du fabricant anglais Vampire Vape, le Pinkman dévoile le plus délicieux trio d'agrumes, entrecitron jaune et vert, orange et pamplemousse. Reconnu dans toute la vaposphère comme LE mélange à ne pas manquer, il est particulièrement adapté aux vapoteurs débutants. Pourquoi choisir ce e liquide en 10ml ? Choisir le Pinkman en e-liquide 10ml, c'est choisir unplaisir immédiat, dans letaux de nicotine exactqu'il vous faut ! Avec ce e liquide, tout devient plus simple. Vous n'avez rien à calculer, à mélanger, à préparer. Vous vous contentez de savourerl'une des recettes d'agrumes les plus plébiscitées, ce, dans le monde entier ! Comment utiliser un tel produit prêt à vaper ? Puisqu'il est prêt à vapoter, le Pinkman 10ml n'a besoin de rien d'autre que votre cigarette électronique ! Après l'avoir commandé sur votre site e-commerce préféré, vous procéderez ainsi : N.B : S'il s'agit d'un premier remplissage avec une nouvelle résistance, patientez 5 à 10 minutes avant de vapoter. Quel taux de nicotine est fait pour moi ? Le Pinkman s'utilise dès réception, ça, d'accord. Mais, avant de l'utiliser, vous voudriez être certain du taux de nicotine à adopter ! A&L vous révèle ses petites astuces : Et, si vous adorez la recette du Pinkman et son format e-liquide 10ml, sachez que vous pourrez également le savourersans nicotine. Vous voyez, il vous accompagne tout au long de votre sevrage tabagique ! À qui est destiné le Pinkman e liquide ? Sans conteste l'une des plus belles réussites du fabricant Vampire Vape, le e-liquide Pinkman est adoré par tous les vapoteurs du monde entier. C'est simple, il est si bien réalisé, qu'il arrive àconvenir à tout le monde! Son format prêt à l'emploi, ses excellentes saveurs d'agrumes, sa qualité exemplaire... Tout fait de lui LE e-liquide à adopter sans hésiter ! Comment est obtenu ce e-liquide pour e-cigarette ? C'estau Royaume-Uni, dans les cuisines de Vampire Vape, que l'aventure du Pinkman commence. Pour faire naître ce futur best-seller, le fabricant anglais a utilisé desingrédients premium, comme des fioles PET de qualité. Dans chaque flacon de Pinkman, vous trouverez les meilleurs arômes alimentaires, du propylène glycol et de la glycérine végétale de qualité pharmaceutique, sans oublier de la nicotine premium (sauf pour sa version en 0 mg). Notez que le fabricant vous propose un ratio PG/VG très équilibré, de 60PG/40VG, et 50PG/50VG pour la version 3 mg. Pour son conditionnement, Vampire Vape choisit des petitscontenants pratiques et sécurisés, munis de bouchons à protection enfant et d'embouts fins propres et pratiques. L'avis des pandas sur le e-liquide Pinkman 10ml Aussi beau à voir que bon à vapoter, ce liquide 10ml pour e cigarette laisse un léger arrière-goût acidulé dans la bouche. Pétillant et bien fruité, son parfum exulte, explose en bouche et vient nous rappeler les douces saveurs du printemps et de l'été. Créatif et gourmand, il enveloppe les papilles avec force. Le e liquide Pinkman devient une évidence pour notre palais : il l'adore et il ne s'en lasse pas. Voilà pourquoi il est autant adoré dans la vaposphère et conseillé pour tout type de vapoteur, surtout les débutants !",Vampire Vape,fruit,"Le fabricant anglais s'est fait reconnaître dans le monde de la vape à travers ses nombreux succès misant principalement sur des saveurs fruitées, avec notamment la recette du Heisenberg ou encore du Pinkman.",26
26,https://www.aromes-et-liquides.fr/e-liquide-alfaliquid/1500-e-liquide-framboise-alfaliquid-10ml.html,Framboise Alfaliquid,https://assets.aromes-et-liquides.fr/55032-thickbox_default/e-liquide-framboise-alfaliquid-10ml.jpg,5.9,10ml,75/25,France,Non,Non,"lime, framboise, fruit rouge","Le e-liquide Framboise est fabriqué en France par la société Alfaliquid à la saveur fruitée de ce petit fruit rouge. Il est composé d'arômes alimentaires, de propylène glycol (PG) et de glycérine végétale (VG) pour un ratio de75PG/25VG. Le Framboise existe en 4 taux de nicotine : 0, 3, 6 et 12mg/ml. Elle est conditionnée en flacon sécurisé de 10ml avec réducteur facilitant le remplissage de vos clearomiseurs. Qui est Alfaliquid ? Le fabricant français s'est fait reconnaître par ses recettes de e-liquides, et ce, au fil du temps. Mettant à l'honneur aussi bien des goûts fruités que classics par exemple, soyez toujours certain de trouver votre prêt à l'emploi avec Alfaliquid. Nos conseils pour utiliser votre e-liquide Framboise L'utilisation d'un e-liquide est exclusivement réservée à la cigarette électronique. Nous vous recommandons de bien agiter votre flacon de e-liquide avant emploi. Pour limiter les risques de fuites et prolonger la durée de vie de vos résistances, nous vous conseillons d'utiliser un clearomiseur adapté au taux PG/VG de votre e-liquide. Quel taux de nicotine choisir pour votre e-liquide ? Le choix de votre taux de nicotine dépend de votre profil de fumeur ainsi que de la cigarette électronique utilisée. Si vous utilisez une cigarette électronique équipée d'une résistance égale ou supérieure à 1 ohm et à une puissance ne dépassant pas les 30 watts, voici nos recommandations pour choisir votre taux de nicotine : Si vous utilisez une cigarette électronique plus performante équipée de résistances dont la valeur est inférieure à 1 ohm et pour une puissance supérieure à 30 watts, nous vous conseillons d'utiliser un taux de nicotine plus faible : Conservation de votre e-liquide Pour une conservation optimale de votre e-liquide, nous vous conseillons de stocker votre flacon à l'abri de la lumière dans un droit sec et à température ambiante. Après contacts répétés à l'air et à la lumière, la couleur de votre e-liquide peut se foncer. Ce changement de couleur n'affecte ni la qualité ni le goût de votre e-liquide. La date indiquée sur l'étiquette est une DLUO (date limite d'utilisation optimale) ou DDM (date de durabilité minimale). Passé cette date, le e-liquide peut encore être consommé. Mises en garde et contre-indications : Précautions d'emploi :",Alfaliquid,fruit,"Le fabricant français s'est fait reconnaître par ses recettes de e-liquides, et ce, au fil du temps. Mettant à l'honneur aussi bien des goûts fruités que classics par exemple, soyez toujours certain de trouver votre prêt à l'emploi avec Alfaliquid. ",27
27,https://www.aromes-et-liquides.fr/e-liquide-chuffed/15254-dragonfruit-and-lychee-100ml-fruits.html,Dragonfruit and Lychee 100ml Fruits Chuffed,https://assets.aromes-et-liquides.fr/45171-thickbox_default/dragonfruit-and-lychee-100ml-fruits.jpg,9.9,100ml (fiole de 120ml),30/70,Royaume-Uni,Oui,Oui,"lime, litchi, fruit du dragon","Le Dragonfruit and Lychee 100ml est un e-liquide à booster issu de la collection Fruits de la marque Chuffed, auxsaveurs fraîches de litchi et de fruit du dragon. Sa recette fabriquée en France se compose d'arômes alimentaires, de propylène glycol (PG) et de glycérine végétale (VG), pour un ratio 30PG/70VG. Présenté dans une fiole de 120ml dotée d'un bouchon sécurisé et d'un embout fin,vous pouvez au besoin lui additionnerdu liquide de base ou des boosters 10ml de nicotine (non inclus). Qui est Chuffed ? Chuffed est une marque originaire du Royaume-Uni, spécialisée dans la conception de e-liquides pour cigarette électronique. Retrouvez les recettes de Chuffed en format de 100ml, non nicotinés de base et à booster en fonction de vos besoins. Comment préparer votre e-liquide Dragonfruit and Lychee ? Ce e-liquide est proposé en version100mlboostée en arômes dans un flacon de120ml. Si vous le souhaitez, vous pouvez ajouter un ou plusieurs boosters de nicotine selon vos besoins sans perte de saveur. Pour booster votre e-liquide, vous devez : Indications pour préparer votre e-liquide surboosté de 50 ml : La place disponible dans le flacon d'origine n’est peut-être pas suffisante pour booster votre e-liquide au taux de nicotine souhaité. Pour les dosages importants, nous vous conseillons l’utilisation de contenants plus importants commeun flacon de 100ml graduéouun flacon Twist de 230ml gradué. Astuce : pensez à adapter votre matériel au ratio PG/VG de votre e-liquide ! Vous limiterez ainsi le risque de fuite et l’usure prématurée de vos résistances ! Quel taux de nicotine choisir pour votre e-liquide ? Le choix de votre taux de nicotine dépend de votre profil de fumeur ainsi que de la cigarette électronique utilisée : Si vous utilisez du matériel plus performant avec une résistance inférieure à 1 ohm et pour une puissance supérieure à 30 watts, vous pouvez diviser votre taux de nicotine par deux. Nos conseils pour la maturation de votre e-liquide surboosté De la même façon que pour un e-liquide DIY, on peut observer un temps de repos avec un e-liquide surboosté en arômes après l’ajout d’un ou plusieurs boosters de nicotine. Ce temps de maturation que l’on appelle aussi “steep” permet aux arômes de se développer et de mieux s’exprimer. Pour une maturation optimale, il faut compter : Pour un rendu optimal : secouez votre fiole de e-liquide une fois par jour pour que les arômes se diffusent correctement. Conservation de votre e-liquide Pour une conservation optimale de votre e-liquide, nous vous conseillons de stocker votre flacon à l'abri de la lumière dans un droit sec et à température ambiante. Après contacts répétés à l'air et à la lumière, la couleur de votre e-liquide peut se foncer. Ce changement de couleur n'affecte ni la qualité ni le goût de votre e-liquide. La date indiquée sur l'étiquette est une DLUO (date limite d'utilisation optimale) ou DDM (date de durabilité minimale). Passé cette date, le e-liquide peut encore être consommé.",Chuffed,fruit,"Chuffed est une marque originaire du Royaume-Uni, spécialisée dans la conception de e-liquides pour cigarette électronique. Retrouvez les recettes de Chuffed en format de 100ml, non nicotinés de base et à booster en fonction de vos besoins.",28
28,https://www.aromes-et-liquides.fr/e-liquide-chuffed/14228-frozen-lemon-and-lime-100ml-ice.html,Frozen Lemon And Lime 100ml Ice Chuffed,https://assets.aromes-et-liquides.fr/42095-thickbox_default/frozen-lemon-and-lime-100ml-ice.jpg,9.9,100ml (fiole de 120ml),30/70,Royaume-Uni,Oui,Oui,"lime, citron, lemon","Le Frozen Lemon And Lime 100ml est un e-liquide à booster issu de la collection Ice de la marque Chuffed, auxsaveurs fraîches de citrons jaunes et verts. Sa recette fabriquée en France se compose d'arômes alimentaires, de propylène glycol (PG) et de glycérine végétale (VG), pour un ratio 30PG/70VG. Présenté dans une fiole de 120ml dotée d'un bouchon sécurisé et d'un embout fin,vous pouvez au besoin lui additionnerdu liquide de base ou des boosters 10ml de nicotine (non inclus). Qui est Chuffed ? Chuffed est une marque originaire du Royaume-Uni, spécialisée dans la conception de e-liquides pour cigarette électronique. Retrouvez les recettes de Chuffed en format de 100ml, non nicotinés de base et à booster en fonction de vos besoins. Comment préparer votre e-liquide Frozen Lemon And Lime ? Ce e-liquide est proposé en version100mlboostée en arômes dans un flacon de120ml. Si vous le souhaitez, vous pouvez ajouter un ou plusieurs boosters de nicotine selon vos besoins sans perte de saveur. Pour booster votre e-liquide, vous devez : Indications pour préparer votre e-liquide surboosté de 50 ml : La place disponible dans le flacon d'origine n’est peut-être pas suffisante pour booster votre e-liquide au taux de nicotine souhaité. Pour les dosages importants, nous vous conseillons l’utilisation de contenants plus importants commeun flacon de 100ml graduéouun flacon Twist de 230ml gradué. Astuce : pensez à adapter votre matériel au ratio PG/VG de votre e-liquide ! Vous limiterez ainsi le risque de fuite et l’usure prématurée de vos résistances ! Quel taux de nicotine choisir pour votre e-liquide ? Le choix de votre taux de nicotine dépend de votre profil de fumeur ainsi que de la cigarette électronique utilisée : Si vous utilisez du matériel plus performant avec une résistance inférieure à 1 ohm et pour une puissance supérieure à 30 watts, vous pouvez diviser votre taux de nicotine par deux. Nos conseils pour la maturation de votre e-liquide surboosté De la même façon que pour un e-liquide DIY, on peut observer un temps de repos avec un e-liquide surboosté en arômes après l’ajout d’un ou plusieurs boosters de nicotine. Ce temps de maturation que l’on appelle aussi “steep” permet aux arômes de se développer et de mieux s’exprimer. Pour une maturation optimale, il faut compter : Pour un rendu optimal : secouez votre fiole de e-liquide une fois par jour pour que les arômes se diffusent correctement. Conservation de votre e-liquide Pour une conservation optimale de votre e-liquide, nous vous conseillons de stocker votre flacon à l'abri de la lumière dans un droit sec et à température ambiante. Après contacts répétés à l'air et à la lumière, la couleur de votre e-liquide peut se foncer. Ce changement de couleur n'affecte ni la qualité ni le goût de votre e-liquide. La date indiquée sur l'étiquette est une DLUO (date limite d'utilisation optimale) ou DDM (date de durabilité minimale). Passé cette date, le e-liquide peut encore être consommé.",Chuffed,fruit,"Chuffed est une marque originaire du Royaume-Uni, spécialisée dans la conception de e-liquides pour cigarette électronique. Retrouvez les recettes de Chuffed en format de 100ml, non nicotinés de base et à booster en fonction de vos besoins.",29
29,https://www.aromes-et-liquides.fr/e-liquide-biggy-bear/16647-cassis-framboise-bleue-200ml.html,Cassis Framboise Bleue 200ml Biggy Bear,https://assets.aromes-et-liquides.fr/49420-thickbox_default/cassis-framboise-bleue-200ml.jpg,14.5,200ml,50/50,France,Oui,Oui,"kiwi, fraise, popcorn, framboise, grenade, cassis, lime","Fabriqué en France par Secret's Lab, le e-liquide pour cigarette électronique Cassis Framboise Bleue est issu de la collection Biggy Bear. Composé d'arômes alimentaires, de propylène glycol (PG) et de glycérine végétale (VG), il vous est proposé dans un ratio50PG/50VG. Sarecette fraîchenon nicotinée de base peut au besoin être additionnée de boosters (non inclus), ceci en vous munissant d'un flacon vide pour réaliser votre mélange. Son flacon de 200ml est équipé d'un bouchon avec protection enfant et d'un embout fin. Qui est Secret's Lab ? Ce fabricant français élabore toutes ses recettes pour cigarettes électroniques dans ses laboratoires situés à Marseille. Secret's Lab est notamment le créateur de gammes de renommées, telles que Secret Keys, Secret Garden, ou encore Biggy Bear. La gamme Biggy Bear La collection mythique à l'effigie d'un ours en peluche est issue de l'imagination des aromaticiens français de Secret's Lab. Retrouvez une gamme de recettes variées, disponibles en format e-liquides ou arômes DIY. Du mix fruité au popcorn caramélisé, vous trouverez sans nul doute la saveur qui vous convient parmi cette vaste collection. Comment préparer votre e-liquide Cassis Framboise Bleue ? Le Grenade Fraise Kiwi est proposé en version200mlboostée en arômes. Si vous le souhaitez, vous pouvez ainsi ajouter un ou plusieurs boosters de nicotine selon vos besoins sans perte de saveur. Pour booster votre e-liquide, vous devez : Indications pour préparer votre e-liquide surboosté de 100 ml : La place disponible dans le flacon d'origine n’est peut-être pas suffisante pour booster votre e-liquide au taux de nicotine souhaité. Pour les dosages importants, nous vous conseillons l’utilisation de contenants plus importants commeun flacon de 100ml graduéouun flacon Twist de 230ml gradué. Astuce : pensez à adapter votre matériel au ratio PG/VG de votre e-liquide ! Vous limiterez ainsi le risque de fuite et l’usure prématurée de vos résistances ! Quel taux de nicotine choisir pour votre e-liquide ? Le choix de votre taux de nicotine dépend de votre profil de fumeur ainsi que de la cigarette électronique utilisée : Si vous utilisez du matériel plus performant avec une résistance inférieure à 1 ohm et pour une puissance supérieure à 30 watts, vous pouvez diviser votre taux de nicotine par deux. Nos conseils pour la maturation de votre e-liquide surboosté De la même façon que pour un e-liquide DIY, on peut observer un temps de repos avec un e-liquide surboosté en arômes après l’ajout d’un ou plusieurs boosters de nicotine. Ce temps de maturation que l’on appelle aussi “steep” permet aux arômes de se développer et de mieux s’exprimer. Pour une maturation optimale, il faut compter : Pour un rendu optimal : secouez votre fiole de e-liquide une fois par jour pour que les arômes se diffusent correctement. Conservation de votre e-liquide Pour une conservation optimale de votre e-liquide, nous vous conseillons de stocker votre flacon à l'abri de la lumière dans un droit sec et à température ambiante. Après contacts répétés à l'air et à la lumière, la couleur de votre e-liquide peut se foncer. Ce changement de couleur n'affecte ni la qualité ni le goût de votre e-liquide. La date indiquée sur l'étiquette est une DLUO (date limite d'utilisation optimale) ou DDM (date de durabilité minimale). Passé cette date, le e-liquide peut encore être consommé.",Secret's Lab,fruit,"Ce fabricant français élabore toutes ses recettes pour cigarettes électroniques dans ses laboratoires situés à Marseille. Secret's Lab est notamment le créateur de gammes de renommées, telles que Secret Keys, Secret Garden, ou encore Biggy Bear.",30
