index,url,nom_produit,img_produit,prix_produit,contenance,pg_vg,origine,frais,surbooste,saveur,description,brand,gout,info_brand,id_produit
0,https://www.aromes-et-liquides.fr/e-liquide-ultimate/9197-e-liquide-ultimate-ragnarok-par-al.html,Ragnarok Ultimate A&L,https://assets.aromes-et-liquides.fr/53645-thickbox_default/e-liquide-ultimate-ragnarok-par-al.jpg,5.9,10ml,50/50,France,Oui,Non,"cassis, lime, fruits rouges, parfait","Le e-liquide Ragnarok par A&L Ultimate est un produitprêt à l'emploipour cigarette électronique. Dans sa fiole 10ml, vous retrouverez des saveurs de fruits rouges, accompagnées d'un goût frais de cassis. Idéal pour débuter, ce e-liquide vous est proposé en différents taux de nicotine au choix : 0, 3, 6, ou 12mg/ml. Qu'est-ce que le Ragnarok Ultimate ? Le Ragnarok, c'est unerecette fraiche aux goûts de fruitsdehaute qualité française, signée Arômes et Liquides (A&L). Ici, vous en profiterez dans sa version e-liquide prêt à vaper. Conforme à la loi TPD, le e liquide Ragnarok est présenté en fiole PET de 10ml. Pourquoi ? Afin de vous assurer unproduit déjà nicotiné à votre convenance! Pourquoi choisir le Ragnarok en e-liquide 10ml ? Simple, pratique et efficace, le e-liquide Ragnarok en 10ml permet de démarrer sans attendre votre séance de vapotage. Déjà minutieusement travaillé, dosé et nicotiné, il vous suffit de le verser dans votre réservoir de cigarette électronique pour l'utiliser ! Le format est doncparfaitement adapté si vous débutez: vous sélectionnez le taux de nicotine qui vous convient, puis vous remplissez votre matériel e-cig, et enfin, vous vapotez son goût de fruits rouges ! Comment s'utilise le Ragnarok e liquide ? Un e-liquide 10ml comme le Ragnarok Ultimate est l'un des produits les plus simples à utiliser : vous le recevez, vous secouez son flacon quelques secondes pour bien mélanger ses arômes, puis vous venez retirer son bouchon sécurisé pour enfin remplir votre e-cigarette. Mais avant, nous direz-vous, quel taux nicotinique faut-il sélectionner ? Quel taux de nicotine choisir pour votre e-liquide ? Le choix de votre taux de nicotine dépend de votre profil de fumeur ainsi que de la cigarette électronique utilisée. Si vous utilisez une cigarette électronique équipée d'une résistance égale ou supérieure à 1ohm et à une puissance ne dépassant pas les 30 watts, voici nos recommandations pour choisir votre taux de nicotine : Si vous utilisez une cigarette électronique plus performante équipée de résistances dont la valeur est inférieure à 1 ohm et pour une puissance supérieure à 30 watts, nous vous conseillons d'utiliser un taux de nicotine plus faible : À qui s'adresse ce e-liquide 10ml ? Avec un tel format prêt à l'emploi, le e-liquide Ragnarok Ultimate se veut particulièrement adapté aux vapoteurs débutants ! Non seulement il sera très facile à utiliser, mais il vous permettra de mieux comprendre et gérer votre taux nicotinique. Quant à son mélange de fruits rouges et de fraicheur, il estspécialement fait pour s'adapter à différents types de vapoteur. De quoi se compose le Ragnarok Ultimate ? Comme tout e-liquide pour cigarette électronique, le Ragnarok se compose d'arômes alimentaires, de propylène glycol (PG) et de glycérine végétale (VG). Tous ces ingrédients sont minutieusement sélectionnés par Arômes et Liquides. Chez nous, ce qui compte, c'est la qualité ! Si la recette du Ragnarok Ultimate est aussi reconnue, c'est bien grâce à cela : avec des composants de premier choix et une fabrication comme un conditionnement100% français, ce e-liquide ne peut être que de qualité premium ! Afin d'équilibrer la recette ainsi que le hit en gorge, A&L propose son e liquide Ultimate Ragnarok en50PG/50VG. Enfin, pour rester conforme à la loi TPD et vous présenter un e-liquide nicotiné, A&L choisit un conditionnement en fioles PET de 10ml, munies de bouchons sécurisés (protections enfant) et d'embouts fins compte-gouttes. N.B : Vous ne trouverez aucune trace de diacétyle dans les produits A&L. De même, aucun test sur des animaux n'est pratiqué chez nous. Conservation de votre e-liquide Pour une conservation optimale de votre e-liquide, nous vous conseillons de stocker votre flacon à l'abri de la lumière dans un droit sec et à température ambiante. Après contacts répétés à l'air et à la lumière, la couleur de votre e-liquide peut se foncer. Ce changement de couleur n'affecte ni la qualité ni le goût de votre e-liquide. La date indiquée sur l'étiquette est une DLUO (date limite d'utilisation optimale) ou DDM (date de durabilité minimale). Passé cette date, le e-liquide peut encore être consommé. Mises en garde et contre-indications : Précautions d'emploi :",Arômes et Liquides (A&L),fruit,"Arômes et Liquides (A&L) est un fabricant français de e-liquides et concentrés DIY depuis 2012. Avec ses laborantins situés non loin de Saint-Étienne dans la Loire, il vous présente une vaste collection de saveurs allant des plus simples aux plus complexes. La marque s'est notamment distinguée dans l'univers de la vape grâce à sa recette classic du Ryan USA de la gamme A&L, puis du mix au goût de fruits rouges Ragnarok de la collection Ultimate. ",1
1,https://www.aromes-et-liquides.fr/e-liquide-ultimate/9200-e-liquide-ultimate-oni-par-al.html,Oni Ultimate A&L,https://assets.aromes-et-liquides.fr/53646-thickbox_default/e-liquide-ultimate-oni-par-al.jpg,5.9,10ml,50/50,France,Oui,Non,"citron vert, lime, parfait, citron","Le Oni Ultimate 10ml est un e-liquide pour cigarette électronique signé Arômes et Liquides (A&L). Il est proposé ici enversion prête à l'emploi. Vous pourrez donc l'utiliser de suite dans votre matériel ! Disponible en plusieurs taux de nicotine (0, 3, 6 et 12mg/ml), il est surtout destiné aux vapoteurs débutants. Mais pas que ! Sonduo de citrons vert et jaune, ainsi que dessaveursfraîchesen font un e-liquide pour tout le monde. Qu'est-ce que le Oni Ultimate ? Le e-liquide Oni ? Unerecetteque l'on ne présente plus mêlant du citron jaune et du citron vert, ainsi que du frais. Plus encore, le Oni Ultimate c'est unformat prêt à vaper, en 10ml, permettant à n'importe quel vapoteur de commencer immédiatement sa séance de vapotage au bon taux nicotinique ! Mais surtout, le e liquide Oni est un produit pour cigarette électronique dequalité premium, entièrement imaginé et fabriqué en France, dans les laboratoires et locaux d'Arômes et Liquides ! Pourquoi choisir le Oni en e-liquide 10ml ? Pensé pour tous les vapoteurs qui débutent dans le monde de la vape, le e-liquide Oni Ultimate se démarque par son format : en fiole 10ml,il contient déjà tout ce qu'il vous faut pour démarrer votre séance de vapotage immédiatement ! Parfaitement travaillé, dosé et nicotiné, il n'a pas besoin d'autre chose que votre cigarette électronique pour être vapoté ! Le e-liquide Oni, c'est la simplicité, en toute praticité et efficacité. Comment s'utilise le Oni e-liquide ? Une fois le taux nicotinique sélectionné, vous recevrez votre ou vos fioles 10ml de e-liquide Oni. Là, vous dévisserez simplement son bouchon sécurisé (attention, protection enfant : appuyez puis tournez). Vous placerez son embout fin dans votre clearomiseur ou atomiseur (dans l'orifice de remplissage dédié) et vous remplirez votre réservoir de ce produit haut en saveurs. Eh oui ! Avec le Oni e-liquide en 10ml c'est tout ce qu'il y a à faire ! Quel taux de nicotine choisir pour votre e-liquide ? Le choix de votre taux de nicotine dépend de votre profil de fumeur ainsi que de la cigarette électronique utilisée. Si vous utilisez une cigarette électronique équipée d'une résistance égale ou supérieure à 1 ohm et à une puissance ne dépassant pas les 30 watts, voici nos recommandations pour choisir votre taux de nicotine : Si vous utilisez une cigarette électronique plus performante équipée de résistances dont la valeur est inférieure à 1 ohm et pour une puissance supérieure à 30 watts, nous vous conseillons d'utiliser un taux de nicotine plus faible : À qui s'adresse ce e-liquide 10ml ? Avec un format aussi simple et pratique, le e-liquide Oni Ultimate 10ml estclairement fait pour les vapoteurs débutants. Mais, en définitive, c'est bien àtout le mondeque s'adresse ce e liquide pour cigarette électronique ! Ses saveurs fraîches de citrons, ainsi que ses différentes déclinaisons nicotiniques satisferont tout type de vapoteurs et son petit format prêt à l'emploi permettra de tester la recette en toute simplicité ! De quoi se compose l'Ultimate Oni ? Chaque produit A&L suit un cahier des charges très strict, de sa conception à son conditionnement final. Nous mettons tout en œuvre pour vous garantir un produit fiable, de haute qualité ! D'abord, en vous proposant une-liquide 100% français et issu d'ingrédients de premier choix: des arômes alimentaires, du propylène glycol (PG) et de la glycérine végétale (VG). Ensuite, en nous assurant que notre produit soit conforme à vos attentes : avec un ratio PG/VG de 50/50, le Oni Ultimate est un compromis idéal entre saveurs, hit en gorge et vapeur. De même, il s'utilise dans tout type de matériel e-cig ! Enfin, en présentant un e liquide conforme à la loi TPD, conditionné en fioles PET sécurisées de 10ml (avec bouchon à protection enfant et embout fin). Mais surtout, en vous certifiant l'absence totale de diacétyle dans nos compositions, de même que des produits non testés sur les animaux ! Conservation de votre e-liquide Pour une conservation optimale de votre e-liquide, nous vous conseillons de stocker votre flacon à l'abri de la lumière dans un droit sec et à température ambiante. Après contacts répétés à l'air et à la lumière, la couleur de votre e-liquide peut se foncer. Ce changement de couleur n'affecte ni la qualité ni le goût de votre e-liquide. La date indiquée sur l'étiquette est une DLUO (date limite d'utilisation optimale) ou DDM (date de durabilité minimale). Passé cette date, le e-liquide peut encore être consommé. Mises en garde et contre-indications : Précautions d'emploi :",Arômes et Liquides (A&L),fruit,"Arômes et Liquides (A&L) est un fabricant français de e-liquides et concentrés DIY depuis 2012. Avec ses laborantins situés non loin de Saint-Étienne dans la Loire, il vous présente une vaste collection de saveurs allant des plus simples aux plus complexes. La marque s'est notamment distinguée dans l'univers de la vape grâce à sa recette classic du Ryan USA de la gamme A&L, puis du mix au goût de fruits rouges Ragnarok de la collection Ultimate. ",2
2,https://www.aromes-et-liquides.fr/e-liquide-al/9185-e-liquide-fruits-rouges-par-al.html,A&L Fruits Rouges,https://assets.aromes-et-liquides.fr/53641-thickbox_default/e-liquide-fruits-rouges-par-al.jpg,4.9,10ml,50/50,France,Non,Non,"baies, baie, fruits rouges, lime, baies rouges","Le Fruits Rouges est un e-liquide auxsaveurs de baies rougespour cigarette électronique fabriqué en France par Arômes et Liquides. Il est composé d'arômes alimentaires, de propylène glycol (PG) et de glycérine végétale (VG) dans unratio 50PG/50VGpour un compromis idéal entre rendu de saveur, hit et volume de vapeur. Le e-liquide Fruits Rouges par A&L est conditionné en fiole de 10ml avec sécurité enfant et embout fin pour faciliter le remplissage des clearomiseurs de vos cigarettes électroniques. Il est disponible en 0, 3, 6 et 12 mg/ml de nicotine. Qui est Arômes et Liquides (A&L) ? Arômes et Liquides (A&L) est un fabricant français de e-liquides et concentrés DIY depuis 2012. Avec ses laborantins situés non loin de Saint-Étienne dans la Loire, il vous présente une vaste collection de saveurs allant des plus simples aux plus complexes. La marque s'est notamment distinguée dans l'univers de la vape grâce à sa recette classic du Ryan USA de la gamme A&L, puis du mix au goût de fruits rouges Ragnarok de la collection Ultimate. Nos conseils pour utiliser votre e-liquide Fruits Rouges L'utilisation d'un e-liquide est exclusivement réservée à la cigarette électronique. Nous vous recommandons de bien agiter votre flacon de e-liquide avant emploi. Pour limiter les risques de fuites et prolonger la durée de vie de vos résistances, nous vous conseillons d'utiliser un clearomiseur adapté au taux PG/VG de votre e-liquide. Quel taux de nicotine choisir pour votre e-liquide ? Le choix de votre taux de nicotine dépend de votre profil de fumeur ainsi que de la cigarette électronique utilisée. Si vous utilisez une cigarette électronique équipée d'une résistance égale ou supérieure à 1 ohm et à une puissance ne dépassant pas les 30 watts, voici nos recommandations pour choisir votre taux de nicotine : Si vous utilisez une cigarette électronique plus performante équipée de résistances dont la valeur est inférieure à 1 ohm et pour une puissance supérieure à 30 watts, nous vous conseillons d'utiliser un taux de nicotine plus faible : Conservation de votre e-liquide Pour une conservation optimale de votre e-liquide, nous vous conseillons de stocker votre flacon à l'abri de la lumière dans un droit sec et à température ambiante. Après contacts répétés à l'air et à la lumière, la couleur de votre e-liquide peut se foncer. Ce changement de couleur n'affecte ni la qualité ni le goût de votre e-liquide. La date indiquée sur l'étiquette est une DLUO (date limite d'utilisation optimale) ou DDM (date de durabilité minimale). Passé cette date, le e-liquide peut encore être consommé. Mises en garde et contre-indications : Précautions d'emploi :",Arômes et Liquides (A&L),fruit,"Arômes et Liquides (A&L) est un fabricant français de e-liquides et concentrés DIY depuis 2012. Avec ses laborantins situés non loin de Saint-Étienne dans la Loire, il vous présente une vaste collection de saveurs allant des plus simples aux plus complexes. La marque s'est notamment distinguée dans l'univers de la vape grâce à sa recette classic du Ryan USA de la gamme A&L, puis du mix au goût de fruits rouges Ragnarok de la collection Ultimate. ",3
3,https://www.aromes-et-liquides.fr/e-liquide-hello-cloudy/13379-red-light-200-ml.html,Red Light 200ml Hello Cloudy,https://assets.aromes-et-liquides.fr/45672-thickbox_default/red-light-200-ml.jpg,11.34,200ml,50/50,France,Oui,Oui,"lime, baie, baies, baies rouges","Le Red Light, unesaveur fraîche de baies rouges, dans cette recette de e-liquide à booster par Hello Cloudy. Présenté dans un format de 200ml non nicotiné, vous pouvez au besoin le personnaliser en ajoutant dans sa fiole des boosters 10ml (non inclus). Fabriqué en France, il se compose d'arômes alimentaires, de propylène glycol (PG) et de glycérine végétale (VG), pour un ratio 50PG/50VG. Son flacon de 200ml est équipé d'un bouchon avec sécurité enfant et d'un embout fin. Qui est Hello Cloudy ? Hello Cloudy est un fabricant français de e-liquides pour cigarettes électroniques. Spécialiste des saveurs de fruits, la marque accompagne parfois ses recettes de fraîcheur. Retrouvez les e-liquides Hello Cloudy en format de 200ml à booster, conditionnés dans des flacons équipés d'une ouverture sécurisée et d'un embout fin. Comment préparer votre e-liquide Red Light ? Ce e-liquide est proposé en version200mlboostée en arômes. Si vous le souhaitez, vous pouvez ainsi ajouter un ou plusieurs boosters de nicotine selon vos besoins sans perte de saveur. Pour booster votre e-liquide, vous devez : Indications pour préparer votre e-liquide surboosté de 200 ml : La place disponible dans le flacon d'origine n’est peut-être pas suffisante pour booster votre e-liquide au taux de nicotine souhaité. Pour les dosages importants, nous vous conseillons l’utilisation de contenants plus importants commeun flacon de 100ml graduéouun flacon Twist de 230ml gradué. Astuce : pensez à adapter votre matériel au ratio PG/VG de votre e-liquide ! Vous limiterez ainsi le risque de fuite et l’usure prématurée de vos résistances ! Quel taux de nicotine choisir pour votre e-liquide ? Le choix de votre taux de nicotine dépend de votre profil de fumeur ainsi que de la cigarette électronique utilisée : Si vous utilisez du matériel plus performant avec une résistance inférieure à 1 ohm et pour une puissance supérieure à 30 watts, vous pouvez diviser votre taux de nicotine par deux. Nos conseils pour la maturation de votre e-liquide surboosté De la même façon que pour un e-liquide DIY, on peut observer un temps de repos avec un e-liquide surboosté en arômes après l’ajout d’un ou plusieurs boosters de nicotine. Ce temps de maturation que l’on appelle aussi “steep” permet aux arômes de se développer et de mieux s’exprimer. Pour une maturation optimale, il faut compter : Pour un rendu optimal : secouez votre fiole de e-liquide une fois par jour pour que les arômes se diffusent correctement. Conservation de votre e-liquide Pour une conservation optimale de votre e-liquide, nous vous conseillons de stocker votre flacon à l'abri de la lumière dans un droit sec et à température ambiante. Après contacts répétés à l'air et à la lumière, la couleur de votre e-liquide peut se foncer. Ce changement de couleur n'affecte ni la qualité ni le goût de votre e-liquide. La date indiquée sur l'étiquette est une DLUO (date limite d'utilisation optimale) ou DDM (date de durabilité minimale). Passé cette date, le e-liquide peut encore être consommé.",Hello Cloudy,fruit,"Hello Cloudy est un fabricant français de e-liquides pour cigarettes électroniques. Spécialiste des saveurs de fruits, la marque accompagne parfois ses recettes de fraîcheur. Retrouvez les e-liquides Hello Cloudy en format de 200ml à booster, conditionnés dans des flacons équipés d'une ouverture sécurisée et d'un embout fin. ",4
4,https://www.aromes-et-liquides.fr/e-liquide-t-juice/3539-e-liquide-red-astaire-par-t-juice.html,Red Astaire T-Juice,https://assets.aromes-et-liquides.fr/55065-thickbox_default/e-liquide-red-astaire-par-t-juice.jpg,4.9,10ml,50/50,Royaume-Uni,Oui,Non,"fruits rouges, raisin, menthol, anis, lime, menthe","Le Red Astaire est un e-liquide qui a rencontré un énorme succès dès son arrivée sur le marché, au point de devenirle all-day de millions de vapoteurs dans le monde. Retrouvez ainsi sonmix frais de fruits rouges, raisin, anis et mentholdans un format prêt à l'emploi et disponible en plusieurs taux de nicotine au choix : 0, 3, 6, 12 et 18mg/ml. Qu'est-ce que le e-liquide Red Astaire ? Le e-liquide Red Astaire est unproduit prêt à l'emploi pour cigarette électronique. Il s'utilise de suite, dès sa réception, et au taux de nicotine de votre choix. D'origine anglaise, le e-liquide Red Astaire est connu pour son goût frais et fruité, entre fruits rouges et raisin, menthe et anis. Pourquoi choisir ce e liquide 10ml ? Le e liquide Red Astaire 10ml est souvent recommandé pour commencer, et l'on comprend pourquoi : son format prêt à vaper le rendpratique à transporter et facile à utiliser, son goût frais et fruitéest proposé danstous les taux de nicotine pour s'adapter à tous les vapoteurs. Choisissez-le donc pour sa praticité, sa simplicité et surtout, sa recette plébiscitée dans le monde entier ! Comment utiliser le Red Astaire e liquide ? Puisqu'il est déjà prêt à être vapoté dans votre e-cigarette, le e-liquide Red Astaire T-Juice ne demandeni préparation ni ajustement. Une fois livré, il suffit de : Facile à utiliser, d'accord. Mais, au niveau du taux nicotinique, lequel faut-il choisir ? Bien choisir son taux de nicotine Pour bien débuter dans le monde de la vape, il faut en passer par un calcul simple : celui du taux nicotinique adapté à votre ancienne (ou actuelle) consommation de cigarettes. Pour vous aider : Si vous hésitez entre deux taux nicotiniques, partez plutôt sur le plus élevé des deux. Vous l'ajusterez ensuite, au besoin ! Notez également que le e-liquide Red Astaire en 10ml est également disponible sans nicotine, soit en 0mg/ml. À qui est destiné le Red Astaire 10ml ? Le e-liquide Red Astaire, c'estLA recette des vapoteurs débutantsqui souhaitent un goût frais et fruité pour les accompagner tout au long de la journée. Si vous faites vos premiers pas dans la vape, ce e liquide est également tout indiqué. Il est prêt à être consommé dans votre cigarette électronique, peu importe le taux de nicotine dont vous avez besoin ! À partir de quoi est créé le e-liquide Red Astaire ? C'est au Royaume-Uni, dans les laboratoires de T-Juice, que chaque fiole de Red Astaire voit le jour. Pour sa recette, le fabricant anglais utiliseseulement des ingrédients de haute qualité, entre arômes alimentaires, propylène glycol et glycérine végétale, sans oublier nicotine (sauf pour sa version en 0mg). Pour son conditionnement, le fabricant anglais opte aussi pour un contenant de qualité : des fioles type PET, en 10ml, avec bouchon sécurisé et embout fin. Et, afin que votre Red Astaire soit utilisable par tous et dans toutes les cigarettes électroniques, T-Juice le réalise dans unratio PG/VG équilibré, de 50/50.",T-Juice,fruit,"Implanté en Angleterre, et plus particulièrement dans le sud-ouest de Londres, la marque T-Juice vous présente une collection de recettes diverses et variées. Que ce soit des e-liquides ou arômes concentrés DIY (Do It Yourself), soyez certain de faire le bon choix avec la marque T-Juice ! Mondialement reconnu pour sa recette du Red Astaire, n'hésitez pas à découvrir des recettes encore plus vastes, mais toujours aussi abouties. ",5
5,https://www.aromes-et-liquides.fr/e-liquide-al/9188-e-liquide-pomme-par-al.html,A&L Pomme,https://assets.aromes-et-liquides.fr/53642-thickbox_default/e-liquide-pomme-par-al.jpg,4.9,10ml,50/50,France,Non,Non,"lime, fruits rouges, pomme","Ce e-liquide pour cigarette électronique augoût de pomme verteest fabriqué en France par Arômes et Liquides (A&L). Il est composé d'arômes alimentaires, de propylène glycol (PG) et de glycérine végétale (VG) dans unratio 50PG/50VGpour un compromis idéal entre rendu de saveur, hit et volume de vapeur. Le e liquide Pomme Verte par A&L est conditionné en fiole de 10 ml avec sécurité enfant et embout fin pour faciliter le remplissage des clearomiseurs de vos cigarettes électroniques. Ce savoureux nectar est disponible en 0, 3, 6 et 12 mg/ml de nicotine. Qui est Arômes et Liquides (A&L) ? Arômes et Liquides (A&L) est un fabricant français de e-liquides et concentrés DIY depuis 2012. Avec ses laborantins situés non loin de Saint-Étienne dans la Loire, il vous présente une vaste collection de saveurs allant des plus simples aux plus complexes. La marque s'est notamment distinguée dans l'univers de la vape grâce à sa recette classic du Ryan USA de la gamme A&L, puis du mix au goût de fruits rouges Ragnarok de la collection Ultimate. Nos conseils pour utiliser votre e-liquide Pomme L'utilisation d'un e-liquide est exclusivement réservée à la cigarette électronique. Nous vous recommandons de bien agiter votre flacon de e-liquide avant emploi. Pour limiter les risques de fuites et prolonger la durée de vie de vos résistances, nous vous conseillons d'utiliser un clearomiseur adapté au taux PG/VG de votre e-liquide. Quel taux de nicotine choisir pour votre e-liquide ? Le choix de votre taux de nicotine dépend de votre profil de fumeur ainsi que de la cigarette électronique utilisée. Si vous utilisez une cigarette électronique équipée d'une résistance égale ou supérieure à 1 ohm et à une puissance ne dépassant pas les 30 watts, voici nos recommandations pour choisir votre taux de nicotine : Si vous utilisez une cigarette électronique plus performante équipée de résistances dont la valeur est inférieure à 1 ohm et pour une puissance supérieure à 30 watts, nous vous conseillons d'utiliser un taux de nicotine plus faible : Conservation de votre e-liquide Pour une conservation optimale de votre e-liquide, nous vous conseillons de stocker votre flacon à l'abri de la lumière dans un droit sec et à température ambiante. Après contacts répétés à l'air et à la lumière, la couleur de votre e-liquide peut se foncer. Ce changement de couleur n'affecte ni la qualité ni le goût de votre e-liquide. La date indiquée sur l'étiquette est une DLUO (date limite d'utilisation optimale) ou DDM (date de durabilité minimale). Passé cette date, le e-liquide peut encore être consommé. Mises en garde et contre-indications : Précautions d'emploi :",Arômes et Liquides (A&L),fruit,"Arômes et Liquides (A&L) est un fabricant français de e-liquides et concentrés DIY depuis 2012. Avec ses laborantins situés non loin de Saint-Étienne dans la Loire, il vous présente une vaste collection de saveurs allant des plus simples aux plus complexes. La marque s'est notamment distinguée dans l'univers de la vape grâce à sa recette classic du Ryan USA de la gamme A&L, puis du mix au goût de fruits rouges Ragnarok de la collection Ultimate. ",6
