index,url,nom_produit,img_produit,prix_produit,contenance,pg_vg,origine,frais,surbooste,saveur,description,brand,gout,info_brand,id_produit
72,https://www.aromes-et-liquides.fr/e-liquide-ultimate/13705-spartacus-al-50ml.html,Spartacus 50ml Ultimate A&L,https://assets.aromes-et-liquides.fr/40501-thickbox_default/spartacus-al-50ml.jpg,18.9,50ml (fiole de 60ml),50/50,France,Oui,Oui,"nectarine, lime, citron","Le Spartacus d'A&L Ultimate vous est proposé en version e-liquide et dans un format à booster et non nicotiné de 50ml. Lemix de nectarines et de citrons aux saveurs fraîchess'adresse particulièrement aux amateurs de grands formats comme de simplicité ! Prêt à l'emploi, le e liquide Ultimate Spartacus s'utilise immédiatement, en 50ml sans nicotine, ou après ajout d'un booster nicotinique, soit en 60ml dans un taux de 3 mg/ml de nicotine. Qu'est-ce que le e-liquide Spartacus en 50ml ? Le e-liquide Spartacus est ce qu'on appelle un « à booster ». Autrement dit, il est prêt à vaper, mais présenté en plus grand format (50ml) et sans nicotine (0mg), conformément à loi TPD. Sa particularité ? Vous permettre de le vapotersans préparation DIY, tout en choisissant entre un taux avec ou sans nicotine. Basé sur la recette originelle du Spartacus, soit dans sa version Sweet/Original, le e-liquide Spartacus en 50ml ne demande rien d'autre qu'une cigarette électronique, voire un booster de nicotine, pour être utilisé de suite ! De haute qualité française, ce produit est entièrement imaginé, créé et conditionné en France dans les locaux d'Arômes et Liquides (A&L). Pourquoi choisir le Spartacus en e liquide 50ml ? Le e-liquide Ultimate Spartacus est directementprêt à être utilisédans votre matériel e-cig. Il vous permettra notamment de tester la recette sans devoir le préparer au préalable (comme c'est le cas pour un arôme concentré). Vous vapoterez donc la recette telle qu'elle a été pensée de base par nos aromaticiens d'A&L Ultimate ! Mais surtout, sa fiole de 60ml présente un double avantage : non seulement vous aurez un contenant qui durera plus longtemps, mais vous pourrez aussi choisir del'utiliser avec ou sans nicotine. Comment utiliser le e-liquide Ultimate Spartacus en 50ml ? Vous recevrez votre e-liquide Spartacus en fiole PET de 60ml. Mais, à l'intérieur, vous trouverez seulement 50ml de son mélange aux saveurs fraîches de fruits. Ce format vous permettra donc : Comment faire ? On vous explique tout ça juste ci-dessous ! La préparation sans nicotine Si vous n'avez désormais plus besoin de nicotine dans vos produits de la vape (bravo!), alors le e-liquide Spartacus pourra être vapoté sans attendre. Vous secouerez seulement sa fiole quelques secondes pour mélanger les arômes, puis vous utiliserez son embout fin pour remplir votre clearomiseur ou atomiseur. La préparation avec nicotine Vous vous demandez sans doute à quoi peut servir une fiole de 60ml seulement remplie à hauteur de 50ml ? Et bien tout simplement à ajouter un booster de nicotine ! Ce faisant, vous passerez de 50ml en 0mg/ml à 60ml en 3mg/ml. Pour ce faire : Attention, ce produit est uniquement fait pour accueillir un booster de nicotine. Au-delà, vous aurez besoin d'un autre contenant vide pour effectuer votre préparation nicotinée. N.B : Cette phase de préparation peut tout à fait être réalisée avec un booster en sels de nicotine ou au CBD. La maturation D'ordinaire, on a tendance à associer la phase de maturation (ou steep) aux arômes concentrés. Pourtant, sachez qu'un e-liquide peut également être placé au repos quelques jours pour optimiser son rendu aromatique. Le e liquide Spartacus 50ml peut donc tout à fait être mis en steep. A&L recommande de le placer48 heuresenviron dans un endroit sec et à l'abri de la lumière. Pour un meilleur résultat, il est conseillé de secouer la fiole de temps à autre. À qui est adressé le e-liquide Spartacus 50ml ? Entre ses nectarines et ses citrons jaunes avec une saveur fraîche, typique des Ultimates, le Spartacus est, qui sait, votre prochainall-dayse trouve peut-être juste ici. Il s'adresse particulièrement aux vapoteurs ayant besoin d'un tux faible en nicotine, soit jusqu'à 3mg/ml avec l'ajout d'un booster (non inclus) directement dans sa fiole. De quoi se compose le e-liquide Ultimate Spartacus en 50ml ? Afin de donner naissance à des produits dehaute qualité, A&L utilise des arômes alimentaires de qualité pharmaceutique, du propylène glycol (PG) et de la glycérine végétale (VG) de premier choix. Le e-liquide Spartacus 50ml ne fait donc pas exception ! À l'intérieur, il reprend arômes alimentaires, propylène glycol à hauteur de 50% et glycérine végétale également à hauteur de 50%. Ce ratio PG/VG de 50/50 vous garantit un compromis entre saveurs, hit en gorge et vapeur, tout comme une compatibilité à tout type de matériel pour cigarette électronique. Si le e liquide Spartacus 50ml présente une qualité exemplaire, c'est surtout grâce aux soins apportés par Arômes et Liquides dans toutes ses étapes de fabrication et de conditionnement. Chacune d'elle est réalisée en France, dans les laboratoires et locaux d'A&L. Voilà unproduit 100% français! Notez que cette version du e-liquide Spartacus Ultimate est seulement proposée en fiole de type PET de 60ml, remplie à hauteur de 50ml. Ce flacon présente également un bouchon sécurisé, avec protection enfant, et un embout fin propre et pratique.",Arômes et Liquides (A&L),fruit,"Arômes et Liquides (A&L) est un fabricant français de e-liquides et concentrés DIY depuis 2012. Avec ses laborantins situés non loin de Saint-Étienne dans la Loire, il vous présente une vaste collection de saveurs allant des plus simples aux plus complexes. La marque s'est notamment distinguée dans l'univers de la vape grâce à sa recette classic du Ryan USA de la gamme A&L, puis du mix au goût de fruits rouges Ragnarok de la collection Ultimate. ",73
73,https://www.aromes-et-liquides.fr/e-liquide-jungle-fever/15032-tropical-fusion-100ml.html,Tropical Fusion 100ml Jungle Fever,https://assets.aromes-et-liquides.fr/44824-thickbox_default/tropical-fusion-100ml.jpg,9.9,100ml (fiole de 120ml),30/70,Espagne,Non,Oui,"ananas, banane, lime, mangue","Le Tropical Fusion 100ml est un e-liquide à booster de la marque Jungle Fever, auxsaveurs de mangue, de banane et d'ananas. Sa recette fabriquée en Espagne se compose d'arômes alimentaires, de propylène glycol (PG) et de glycérine végétale (VG), pour un ratio 30PG/70VG. Présenté dans une fiole de 120ml dotée d'un bouchon sécurisé et d'un embout fin,vous pouvez au besoin lui additionnerdu liquide de base ou des boosters 10ml de nicotine (non inclus). Qui est Jungle Fever ? Jungle Fever est un fabricant espagnol de e-liquides pour cigarettes électroniques. La marque est spécialisée dans les grands formats, vous proposant des e-liquides en 100ml non nicotinés de base, à booster. Les recettes Jungle Fever sont consacrées aux saveurs de fruits, accompagnées pour certaines de fraîcheur ! Comment préparer votre e-liquide Tropical Fusion ? Ce e-liquide est proposé en version100mlboostée en arômes dans un flacon de120ml. Si vous le souhaitez, vous pouvez ajouter des boosters de nicotine selon vos besoins sans perte de saveur. Pour booster votre e-liquide, vous devez : Indications pour préparer votre e-liquide surboosté de 50 ml : La place disponible dans le flacon d'origine n’est peut-être pas suffisante pour booster votre e-liquide au taux de nicotine souhaité. Pour les dosages importants, nous vous conseillons l’utilisation de contenants plus importants commeun flacon de 100ml graduéouun flacon Twist de 230ml gradué. Astuce : pensez à adapter votre matériel au ratio PG/VG de votre e-liquide ! Vous limiterez ainsi le risque de fuite et l’usure prématurée de vos résistances ! Quel taux de nicotine choisir pour votre e-liquide ? Le choix de votre taux de nicotine dépend de votre profil de fumeur ainsi que de la cigarette électronique utilisée : Si vous utilisez du matériel plus performant avec une résistance inférieure à 1 ohm et pour une puissance supérieure à 30 watts, vous pouvez diviser votre taux de nicotine par deux. Nos conseils pour la maturation de votre e-liquide surboosté De la même façon que pour un e-liquide DIY, on peut observer un temps de repos avec un e-liquide surboosté en arômes après l’ajout d’un ou plusieurs boosters de nicotine. Ce temps de maturation que l’on appelle aussi “steep” permet aux arômes de se développer et de mieux s’exprimer. Pour une maturation optimale, il faut compter : Pour un rendu optimal : secouez votre fiole de e-liquide une fois par jour pour que les arômes se diffusent correctement. Conservation de votre e-liquide Pour une conservation optimale de votre e-liquide, nous vous conseillons de stocker votre flacon à l'abri de la lumière dans un droit sec et à température ambiante. Après contacts répétés à l'air et à la lumière, la couleur de votre e-liquide peut se foncer. Ce changement de couleur n'affecte ni la qualité ni le goût de votre e-liquide. La date indiquée sur l'étiquette est une DLUO (date limite d'utilisation optimale) ou DDM (date de durabilité minimale). Passé cette date, le e-liquide peut encore être consommé.",Jungle Fever,fruit,"Jungle Fever est un fabricant espagnol de e-liquides pour cigarettes électroniques. La marque est spécialisée dans les grands formats, vous proposant des e-liquides en 100ml non nicotinés de base, à booster. Les recettes Jungle Fever sont consacrées aux saveurs de fruits, accompagnées pour certaines de fraîcheur ! ",74
74,https://www.aromes-et-liquides.fr/e-liquide-fruizee/5761-e-liquide-fruizee-bloody-summer-50ml-par-eliquid-france.html,Bloody Summer 50ml Fruizee,https://assets.aromes-et-liquides.fr/15514-thickbox_default/e-liquide-fruizee-bloody-summer-50ml-par-eliquid-france.jpg,16.9,50ml (fiole de 60ml),30/70,France,Oui,Oui,"baies, baie, raisin, cassis, lime, baies rouges","Le Bloody Summer est un e-liquideà boosterde la collection Fruizee par Eliquid France, auxsaveurs fraîches de baies rouges, de raisin et de cassis. Sa recette fabriquée en France se compose d'arômes alimentaires, de propylène glycol (PG) et de glycérine végétale (VG), pour un ratio 30PG/70VG. Vous pouvez au besoin ajouter un booster 10ml de nicotine (non inclus). Il vous est livré dans unflacon de 60mldoté d'un embout fin et d'un bouchon avec sécurité enfant. Qui est Eliquid France ? Créé en 2013 à Nieul sur Mer en Charente-Maritime, le laboratoire Eliquid France s'est fait une place de choix dans l'univers de la vape grâce à des liquides de qualité, exportant ses créations dans le monde entier. Toujours en recherche d'innovation, la marque française propose des recettes variées aux saveurs allant de simples à complexes, et se déclinant autant en arôme DIY qu'en e-liquide prêt à vaper. La gamme Fruizee Collection ayant fait la réputation de la marque Eliquid France, elle mélange des saveurs fraîches de fruits finement réalisées, dans des recettes DIY comme dans des e-liquides prêts à vaper ou à booster ! Comment préparer votre e-liquide Bloody Summer ? Le Bloody Summer est proposé en version50mlboostée en arômes dans un flacon de60ml. Si vous le souhaitez, vous pouvez ainsi ajouter un booster de nicotine selon vos besoins sans perte de saveur. Pour booster votre e-liquide, vous devez : Indications pour préparer votre e-liquide surboosté de 50 ml : La place disponible dans le flacon d'origine n’est peut-être pas suffisante pour booster votre e-liquide au taux de nicotine souhaité. Pour les dosages importants, nous vous conseillons l’utilisation de contenants plus importants commeun flacon de 100ml graduéouun flacon Twist de 230ml gradué. Astuce : pensez à adapter votre matériel au ratio PG/VG de votre e-liquide ! Vous limiterez ainsi le risque de fuite et l’usure prématurée de vos résistances ! Quel taux de nicotine choisir pour votre e-liquide ? Le choix de votre taux de nicotine dépend de votre profil de fumeur ainsi que de la cigarette électronique utilisée : Si vous utilisez du matériel plus performant avec une résistance inférieure à 1 ohm et pour une puissance supérieure à 30 watts, vous pouvez diviser votre taux de nicotine par deux. Nos conseils pour la maturation de votre e-liquide surboosté De la même façon que pour un e-liquide DIY, on peut observer un temps de repos avec un e-liquide surboosté en arômes après l’ajout d’un ou plusieurs boosters de nicotine. Ce temps de maturation que l’on appelle aussi “steep” permet aux arômes de se développer et de mieux s’exprimer. Pour une maturation optimale, il faut compter : Pour un rendu optimal : secouez votre fiole de e-liquide une fois par jour pour que les arômes se diffusent correctement. Conservation de votre e-liquide Pour une conservation optimale de votre e-liquide, nous vous conseillons de stocker votre flacon à l'abri de la lumière dans un droit sec et à température ambiante. Après contacts répétés à l'air et à la lumière, la couleur de votre e-liquide peut se foncer. Ce changement de couleur n'affecte ni la qualité ni le goût de votre e-liquide. La date indiquée sur l'étiquette est une DLUO (date limite d'utilisation optimale) ou DDM (date de durabilité minimale). Passé cette date, le e-liquide peut encore être consommé.",Eliquid France,fruit,"Créé en 2013 à Nieul sur Mer en Charente-Maritime, le laboratoire Eliquid France s'est fait une place de choix dans l'univers de la vape grâce à des liquides de qualité, exportant ses créations dans le monde entier. Toujours en recherche d'innovation, la marque française propose des recettes variées aux saveurs allant de simples à complexes, et se déclinant autant en arôme DIY qu'en e-liquide prêt à vaper.",75
75,https://www.aromes-et-liquides.fr/e-liquide-pulp/4838-e-liquide-cherry-frost-par-pulp.html,Cherry Frost Frost & Furious PULP,https://assets.aromes-et-liquides.fr/54918-thickbox_default/e-liquide-cherry-frost-par-pulp.jpg,6.5,10ml,40/60,France,Oui,Non,"baies, baie, cerise, lime, baies noires","Le fabricant français vous propose unduo frais et fruitéà vapoter, aux saveurs de baies noires et de cerises. Notez que ce e liquide estprêt à vapoter.Vous choisirez votre taux de nicotine parmi ceux proposés (0, 3, 6 et 12mg/ml), puis vous le verserez simplement dans votre matériel de vape ! Le Cherry Frost est un e-liquide pour cigarettes électroniques d'origine française. Son fabricant, PULP, l'a réalisé à partir d'arômes alimentaires, de propylène glycol et de glycérine végétale pour un ratio PG/VG de 40/60. Conditionné en fiole PET souple, il dispose d'un bouchon à sécurité enfant et d'un embout fin propre et pratique, à dropper fin. Qui est PULP ? C'est dans leur laboratoire français, et plus particulièrement parisien que les aromaticiens de la marque PULP conçoivent leurs multiples recettes, et ce, toujours avec le sens du détail. Ainsi, il vous présente aussi bien des e-liquides prêts à vaper, à booster, ou encore des concentrés DIY (Do It Yourself) aux saveurs finement reproduites et de diverses variétés. Nos conseils pour utiliser votre e-liquide Cherry Frost L'utilisation d'un e-liquide est exclusivement réservée à la cigarette électronique. Nous vous recommandons de bien agiter votre flacon de e-liquide avant emploi. Pour limiter les risques de fuites et prolonger la durée de vie de vos résistances, nous vous conseillons d'utiliser un clearomiseur adapté au taux PG/VG de votre e-liquide. Quel taux de nicotine choisir pour votre e-liquide ? Le choix de votre taux de nicotine dépend de votre profil de fumeur ainsi que de la cigarette électronique utilisée. Si vous utilisez une cigarette électronique équipée d'une résistance égale ou supérieure à 1 ohm et à une puissance ne dépassant pas les 30 watts, voici nos recommandations pour choisir votre taux de nicotine : Si vous utilisez une cigarette électronique plus performante équipée de résistances dont la valeur est inférieure à 1 ohm et pour une puissance supérieure à 30 watts, nous vous conseillons d'utiliser un taux de nicotine plus faible : Conservation de votre e-liquide Pour une conservation optimale de votre e-liquide, nous vous conseillons de stocker votre flacon à l'abri de la lumière dans un droit sec et à température ambiante. Après contacts répétés à l'air et à la lumière, la couleur de votre e-liquide peut se foncer. Ce changement de couleur n'affecte ni la qualité ni le goût de votre e-liquide. La date indiquée sur l'étiquette est une DLUO (date limite d'utilisation optimale) ou DDM (date de durabilité minimale). Passé cette date, le e-liquide peut encore être consommé. Mises en garde et contre-indications : Précautions d'emploi :",PULP,fruit,"C'est dans leur laboratoire français, et plus particulièrement parisien que les aromaticiens de la marque PULP conçoivent leurs multiples recettes, et ce, toujours avec le sens du détail. Ainsi, il vous présente aussi bien des e-liquides prêts à vaper, à booster, ou encore des concentrés DIY (Do It Yourself) aux saveurs finement reproduites et de diverses variétés. ",76
76,https://www.aromes-et-liquides.fr/e-liquide-biggy-bear/17324-fruits-rouges-givre-200ml.html,Fruits Rouges Givré 200ml Biggy Bear,https://assets.aromes-et-liquides.fr/51961-thickbox_default/fruits-rouges-givre-200ml.jpg,14.5,200ml,50/50,France,Oui,Oui,"kiwi, fraise, fruits rouges, popcorn, grenade, lime","Fabriqué en France par Secret's Lab, le e-liquide pour cigarette électronique Fruits Rouges Givré est issu de la collection Biggy Bear. Composé d'arômes alimentaires, de propylène glycol (PG) et de glycérine végétale (VG), il vous est proposé dans un ratio50PG/50VG. Sarecette fraîchenon nicotinée de base peut au besoin être additionnée de boosters (non inclus), ceci en vous munissant d'un flacon vide pour réaliser votre mélange. Son flacon de 200ml est équipé d'un bouchon avec protection enfant et d'un embout fin. Qui est Secret's Lab ? Ce fabricant français élabore toutes ses recettes pour cigarettes électroniques dans ses laboratoires situés à Marseille. Secret's Lab est notamment le créateur de gammes de renommées, telles que Secret Keys, Secret Garden, ou encore Biggy Bear. La gamme Biggy Bear La collection mythique à l'effigie d'un ours en peluche est issue de l'imagination des aromaticiens français de Secret's Lab. Retrouvez une gamme de recettes variées, disponibles en format e-liquides ou arômes DIY. Du mix fruité au popcorn caramélisé, vous trouverez sans nul doute la saveur qui vous convient parmi cette vaste collection. Comment préparer votre e-liquide Fruits Rouges Givré ? Le Grenade Fraise Kiwi est proposé en version200mlboostée en arômes. Si vous le souhaitez, vous pouvez ainsi ajouter un ou plusieurs boosters de nicotine selon vos besoins sans perte de saveur. Pour booster votre e-liquide, vous devez : Indications pour préparer votre e-liquide surboosté de 100 ml : La place disponible dans le flacon d'origine n’est peut-être pas suffisante pour booster votre e-liquide au taux de nicotine souhaité. Pour les dosages importants, nous vous conseillons l’utilisation de contenants plus importants commeun flacon de 100ml graduéouun flacon Twist de 230ml gradué. Astuce : pensez à adapter votre matériel au ratio PG/VG de votre e-liquide ! Vous limiterez ainsi le risque de fuite et l’usure prématurée de vos résistances ! Quel taux de nicotine choisir pour votre e-liquide ? Le choix de votre taux de nicotine dépend de votre profil de fumeur ainsi que de la cigarette électronique utilisée : Si vous utilisez du matériel plus performant avec une résistance inférieure à 1 ohm et pour une puissance supérieure à 30 watts, vous pouvez diviser votre taux de nicotine par deux. Nos conseils pour la maturation de votre e-liquide surboosté De la même façon que pour un e-liquide DIY, on peut observer un temps de repos avec un e-liquide surboosté en arômes après l’ajout d’un ou plusieurs boosters de nicotine. Ce temps de maturation que l’on appelle aussi “steep” permet aux arômes de se développer et de mieux s’exprimer. Pour une maturation optimale, il faut compter : Pour un rendu optimal : secouez votre fiole de e-liquide une fois par jour pour que les arômes se diffusent correctement. Conservation de votre e-liquide Pour une conservation optimale de votre e-liquide, nous vous conseillons de stocker votre flacon à l'abri de la lumière dans un droit sec et à température ambiante. Après contacts répétés à l'air et à la lumière, la couleur de votre e-liquide peut se foncer. Ce changement de couleur n'affecte ni la qualité ni le goût de votre e-liquide. La date indiquée sur l'étiquette est une DLUO (date limite d'utilisation optimale) ou DDM (date de durabilité minimale). Passé cette date, le e-liquide peut encore être consommé.",Secret's Lab,fruit,"Ce fabricant français élabore toutes ses recettes pour cigarettes électroniques dans ses laboratoires situés à Marseille. Secret's Lab est notamment le créateur de gammes de renommées, telles que Secret Keys, Secret Garden, ou encore Biggy Bear.",77
77,https://www.aromes-et-liquides.fr/e-liquide-vdlv/3744-e-liquide-cerise-par-vdlv.html,Cerise VDLV,https://assets.aromes-et-liquides.fr/54973-thickbox_default/e-liquide-cerise-par-vdlv.jpg,5.9,10ml,60/40,France,Non,Non,"lime, cerise, vin","Le Cerise est un e liquide pour cigarette électronique prêt à l'emploi fabriqué en France par Vincent Dans Les Vapes (VDLV. Sa recette augoût fruité de cerisesest composée d'arômes alimentaires, de propylène glycol et de glycérine végétale dans un ratio PG/VG de 60/40. Vous le retrouverez dans une fiole PET de 10ml, munie d'un bouchon sécurisé et d'un embout fin propre et pratique. Vous choisirez simplement entre ses différents taux de nicotine au choix :0, 3, 6 et 12mg/ml. Qui est VDLV ? VDLV, pour Vincent Dans Les Vapes, est un fabricant français de liquides pour cigarette électronique. Depuis 2012, la marque basée en Gironde s'attache à proposer des produits de qualité aux vapoteurs du monde entier. Fort de diverses gammes telles que Cirkus, Classic Wanted ou encore V'ICE, VDLV s'adresse autant aux amateurs de e-liquides prêts à vaper qu'aux utilisateurs d'arômes DIY. Nos conseils pour utiliser votre e-liquide Cerise L'utilisation d'un e-liquide est exclusivement réservée à la cigarette électronique. Nous vous recommandons de bien agiter votre flacon de e-liquide avant emploi. Pour limiter les risques de fuites et prolonger la durée de vie de vos résistances, nous vous conseillons d'utiliser un clearomiseur adapté au taux PG/VG de votre e-liquide. Quel taux de nicotine choisir pour votre e-liquide ? Le choix de votre taux de nicotine dépend de votre profil de fumeur ainsi que de la cigarette électronique utilisée. Si vous utilisez une cigarette électronique équipée d'une résistance égale ou supérieure à 1 ohm et à une puissance ne dépassant pas les 30 watts, voici nos recommandations pour choisir votre taux de nicotine : Si vous utilisez une cigarette électronique plus performante équipée de résistances dont la valeur est inférieure à 1 ohm et pour une puissance supérieure à 30 watts, nous vous conseillons d'utiliser un taux de nicotine plus faible : Conservation de votre e-liquide Pour une conservation optimale de votre e-liquide, nous vous conseillons de stocker votre flacon à l'abri de la lumière dans un droit sec et à température ambiante. Après contacts répétés à l'air et à la lumière, la couleur de votre e-liquide peut se foncer. Ce changement de couleur n'affecte ni la qualité ni le goût de votre e-liquide. La date indiquée sur l'étiquette est une DLUO (date limite d'utilisation optimale) ou DDM (date de durabilité minimale). Passé cette date, le e-liquide peut encore être consommé. Mises en garde et contre-indications : Précautions d'emploi :",VDLV,fruit,"VDLV, pour Vincent Dans Les Vapes, est un fabricant français de liquides pour cigarette électronique. Depuis 2012, la marque basée en Gironde s'attache à proposer des produits de qualité aux vapoteurs du monde entier. Fort de diverses gammes telles que Cirkus, Classic Wanted ou encore V'ICE, VDLV s'adresse autant aux amateurs de e-liquides prêts à vaper qu'aux utilisateurs d'arômes DIY.",78
