index,url,nom_produit,img_produit,prix_produit,contenance,pg_vg,origine,frais,surbooste,saveur,description,brand,gout,info_brand,id_produit
48,https://www.aromes-et-liquides.fr/e-liquide-devil/7195-e-liquide-red-devil-par-avap.html,Red Devil AVAP,https://assets.aromes-et-liquides.fr/54356-thickbox_default/e-liquide-red-devil-par-avap.jpg,4.9,10ml,50/50,France,Oui,Non,"parfait, fruits rouges, réglisse, anis, lime","Le Red Devil par AVAP est un e-liquide pour cigarette électronique fabriqué en France à la saveurfraîchede fruits rouges, d'anis et de réglisse. Il est composé d'arômes alimentaires, de propylène glycol (PG) et de glycérine végétale (VG) pour un ratio de50PG/50VG. Un équilibre parfait pour une vape alliant un hit satisfaisant, un bon rendu de saveurs et un grand volume de vapeur. Il est disponible dans un flacon de 10 ml disposant d'une sécurité enfant et d'un embout fin pour faciliter le remplissage de vos clearomiseurs. Retrouvez-le à différents taux de nicotine selon votre besoin. Qui est AVAP ? AVAP est un fabricant français, et plus particulièrement du nord de la France à Cambrai, de e-liquides prêts à vaper ou à booster, mais également de concentrés DIY (Do It Yourself). La marque s'est fait connaître et reconnaître pour sa collection Devil, et plus précisément le Red Devil ! Nos conseils pour utiliser votre e-liquide Red Devil L'utilisation d'un e-liquide est exclusivement réservée à la cigarette électronique. Nous vous recommandons de bien agiter votre flacon de e-liquide avant emploi. Pour limiter les risques de fuites et prolonger la durée de vie de vos résistances, nous vous conseillons d'utiliser un clearomiseur adapté au taux PG/VG de votre e-liquide. Quel taux de nicotine choisir pour votre e-liquide ? Le choix de votre taux de nicotine dépend de votre profil de fumeur ainsi que de la cigarette électronique utilisée. Si vous utilisez une cigarette électronique équipée d'une résistance égale ou supérieure à 1 ohm et à une puissance ne dépassant pas les 30 watts, voici nos recommandations pour choisir votre taux de nicotine : Si vous utilisez une cigarette électronique plus performante équipée de résistances dont la valeur est inférieure à 1 ohm et pour une puissance supérieure à 30 watts, nous vous conseillons d'utiliser un taux de nicotine plus faible : Conservation de votre e-liquide Pour une conservation optimale de votre e-liquide, nous vous conseillons de stocker votre flacon à l'abri de la lumière dans un droit sec et à température ambiante. Après contacts répétés à l'air et à la lumière, la couleur de votre e-liquide peut se foncer. Ce changement de couleur n'affecte ni la qualité ni le goût de votre e-liquide. La date indiquée sur l'étiquette est une DLUO (date limite d'utilisation optimale) ou DDM (date de durabilité minimale). Passé cette date, le e-liquide peut encore être consommé. Mises en garde et contre-indications : Précautions d'emploi :",AVAP,fruit,"AVAP est un fabricant français, et plus particulièrement du nord de la France à Cambrai, de e-liquides prêts à vaper ou à booster, mais également de concentrés DIY (Do It Yourself). La marque s'est fait connaître et reconnaître pour sa collection Devil, et plus précisément le Red Devil ! ",49
49,https://www.aromes-et-liquides.fr/e-liquide-pulp/10455-e-liquide-ananas-maui-par-pulp.html,Ananas Maui PULP,https://assets.aromes-et-liquides.fr/54927-thickbox_default/e-liquide-ananas-maui-par-pulp.jpg,5.9,10ml,70/30,France,Non,Non,"ananas, lime","PULP revient sur le devant de la scène avec son Ananas Maui, un e-liquide pour cigarette électronique au goût fruité. Le Ananas Maui est fabriqué en France par PULP et vous est proposé dans un formatprêt à l'emploi. Il est composé d'arômes alimentaires, de propylène glycol (PG) et de glycérine végétale (VG) dans un ratio de 70PG/30VG. Son flacon de 10ml est équipé d'un bouchon avec sécurité enfant et embout fin pour faciliter le remplissage de votre réservoir. Ce produit est disponible en 0, 3, 6, ou 12mg/ml de nicotine. Qui est PULP ? C'est dans leur laboratoire français, et plus particulièrement parisien que les aromaticiens de la marque PULP conçoivent leurs multiples recettes, et ce, toujours avec le sens du détail. Ainsi, il vous présente aussi bien des e-liquides prêts à vaper, à booster, ou encore des concentrés DIY (Do It Yourself) aux saveurs finement reproduites et de diverses variétés. Nos conseils pour utiliser votre e-liquide Ananas Maui L'utilisation d'un e-liquide est exclusivement réservée à la cigarette électronique. Nous vous recommandons de bien agiter votre flacon de e-liquide avant emploi. Pour limiter les risques de fuites et prolonger la durée de vie de vos résistances, nous vous conseillons d'utiliser un clearomiseur adapté au taux PG/VG de votre e-liquide. Quel taux de nicotine choisir pour votre e-liquide ? Le choix de votre taux de nicotine dépend de votre profil de fumeur ainsi que de la cigarette électronique utilisée. Si vous utilisez une cigarette électronique équipée d'une résistance égale ou supérieure à 1 ohm et à une puissance ne dépassant pas les 30 watts, voici nos recommandations pour choisir votre taux de nicotine : Si vous utilisez une cigarette électronique plus performante équipée de résistances dont la valeur est inférieure à 1 ohm et pour une puissance supérieure à 30 watts, nous vous conseillons d'utiliser un taux de nicotine plus faible : Conservation de votre e-liquide Pour une conservation optimale de votre e-liquide, nous vous conseillons de stocker votre flacon à l'abri de la lumière dans un droit sec et à température ambiante. Après contacts répétés à l'air et à la lumière, la couleur de votre e-liquide peut se foncer. Ce changement de couleur n'affecte ni la qualité ni le goût de votre e-liquide. La date indiquée sur l'étiquette est une DLUO (date limite d'utilisation optimale) ou DDM (date de durabilité minimale). Passé cette date, le e-liquide peut encore être consommé. Mises en garde et contre-indications : Précautions d'emploi :",PULP,fruit,"C'est dans leur laboratoire français, et plus particulièrement parisien que les aromaticiens de la marque PULP conçoivent leurs multiples recettes, et ce, toujours avec le sens du détail. Ainsi, il vous présente aussi bien des e-liquides prêts à vaper, à booster, ou encore des concentrés DIY (Do It Yourself) aux saveurs finement reproduites et de diverses variétés. ",50
50,https://www.aromes-et-liquides.fr/e-liquide-fruizee/4857-e-liquide-fruizee-bloody-summer-par-eliquid-france.html,Bloody Summer Fruizee,https://assets.aromes-et-liquides.fr/54550-thickbox_default/e-liquide-fruizee-bloody-summer-par-eliquid-france.jpg,4.9,10ml,50/50,France,Oui,Non,"parfait, fruits rouges, raisin, cassis, lime","Le Bloody Summer de la gamme Fruizee est un e-liquide pour cigarette électronique mêlant des saveurs fraîches de fruits rouges, de raisins blancs et de cassis Fabriqué en France par Eliquid France, il contient arômes alimentaires, propylène glycol (PG) et glycérine végétale (VG) pour unratio 50PG/50VG. Il vous est proposé ici en version 10ml, déjà prête à l'emploi, pour une excellente production de vapeur, avec un rendu de saveurs parfaitement équilibré. Proposé en fiole souple de type PET d'une contenance de 10ml, votre e-liquide Bloody Summer Fruizee par Eliquid France est disponible en plusieurs taux de nicotine : 0, 3, 6, 12, 18mg/ml de nicotine. De même, pour la sécurité des plus jeunes et votre confort de remplissage, votre flacon comportera à la fois un bouchon avec protection enfant, mais également un embout fin très pratique. Qui est Eliquid France ? Créé en 2013 à Nieul sur Mer en Charente-Maritime, le laboratoire Eliquid France s'est fait une place de choix dans l'univers de la vape grâce à des liquides de qualité, exportant ses créations dans le monde entier. Toujours en recherche d'innovation, la marque française propose des recettes variées aux saveurs allant de simples à complexes, et se déclinant autant en arôme DIY qu'en e-liquide prêt à vaper. La gamme Fruizee Collection ayant fait la réputation de la marque Eliquid France, elle mélange des saveurs fruitées et fraîches finement réalisées dans des recettes DIY comme dans des e-liquides prêts à vaper ou à booster ! Nos conseils pour utiliser votre e-liquide Bloody Summer L'utilisation d'un e-liquide est exclusivement réservée à la cigarette électronique. Nous vous recommandons de bien agiter votre flacon de e-liquide avant emploi. Pour limiter les risques de fuites et prolonger la durée de vie de vos résistances, nous vous conseillons d'utiliser un clearomiseur adapté au taux PG/VG de votre e-liquide. Quel taux de nicotine choisir pour votre e-liquide ? Le choix de votre taux de nicotine dépend de votre profil de fumeur ainsi que de la cigarette électronique utilisée. Si vous utilisez une cigarette électronique équipée d'une résistance égale ou supérieure à 1 ohm et à une puissance ne dépassant pas les 30 watts, voici nos recommandations pour choisir votre taux de nicotine : Si vous utilisez une cigarette électronique plus performante équipée de résistances dont la valeur est inférieure à 1 ohm et pour une puissance supérieure à 30 watts, nous vous conseillons d'utiliser un taux de nicotine plus faible : Conservation de votre e-liquide Pour une conservation optimale de votre e-liquide, nous vous conseillons de stocker votre flacon à l'abri de la lumière dans un droit sec et à température ambiante. Après contacts répétés à l'air et à la lumière, la couleur de votre e-liquide peut se foncer. Ce changement de couleur n'affecte ni la qualité ni le goût de votre e-liquide. La date indiquée sur l'étiquette est une DLUO (date limite d'utilisation optimale) ou DDM (date de durabilité minimale). Passé cette date, le e-liquide peut encore être consommé. Mises en garde et contre-indications : Précautions d'emploi :",Eliquid France,fruit,"Créé en 2013 à Nieul sur Mer en Charente-Maritime, le laboratoire Eliquid France s'est fait une place de choix dans l'univers de la vape grâce à des liquides de qualité, exportant ses créations dans le monde entier. Toujours en recherche d'innovation, la marque française propose des recettes variées aux saveurs allant de simples à complexes, et se déclinant autant en arôme DIY qu'en e-liquide prêt à vaper.",51
51,https://www.aromes-et-liquides.fr/e-liquide-cirkus-vdlv/3295-e-liquide-cirkus-pasteque-mix-par-vdlv.html,Pastèque Mix Cirkus VDLV,https://assets.aromes-et-liquides.fr/54972-thickbox_default/e-liquide-cirkus-pasteque-mix-par-vdlv.jpg,5.9,10ml,50/50,France,Non,Non,"lime, vin, pastèque","Le Pastèque Mix est une-liquide prêt à l'emploide la gamme Cirkus fabriqué en France par VDLV. Les e-liquides de Vincent Dans Les Vapes sont proposés en flacons de type PET de 10ml à embouts fins pour faciliter le remplissage de toutes vos cigarettes électroniques. Sa recette fruitée augoût de pastèqueest composée d'arômes alimentaires, de propylène glycol et de glycérine végétale, avec un ratio de 50/50. Retrouvez le e-liquide Pastèque Mix en deux taux de nicotine au choix : 3mg/ml et 12mg/ml de nicotine. Qui est VDLV ? VDLV, pour Vincent Dans Les Vapes, est un fabricant français de liquides pour cigarette électronique. Depuis 2012, la marque basée en Gironde s'attache à proposer des produits de qualité aux vapoteurs du monde entier. Fort de diverses gammes telles que Cirkus, Classic Wanted ou encore V'ICE, VDLV s'adresse autant aux amateurs de e-liquides prêts à vaper qu'aux utilisateurs d'arômes DIY. La gamme Cirkus Si le fabricant français bénéficie d'une place de choix dans l'univers de la vape, c'est notamment grâce à sa collection Cirkus. Cette gamme de recettes variées se décline autant en e-liquides prêts à vaper qu'en arômes DIY (Do It Yourself). Découvrez toute une série de produits à vaper de qualité, d'origine 100% française. Nos conseils pour utiliser votre e-liquide Pastèque Mix L'utilisation d'un e-liquide est exclusivement réservée à la cigarette électronique. Nous vous recommandons de bien agiter votre flacon de e-liquide avant emploi. Pour limiter les risques de fuites et prolonger la durée de vie de vos résistances, nous vous conseillons d'utiliser un clearomiseur adapté au taux PG/VG de votre e-liquide. Quel taux de nicotine choisir pour votre e-liquide ? Le choix de votre taux de nicotine dépend de votre profil de fumeur ainsi que de la cigarette électronique utilisée. Si vous utilisez une cigarette électronique équipée d'une résistance égale ou supérieure à 1 ohm et à une puissance ne dépassant pas les 30 watts, voici nos recommandations pour choisir votre taux de nicotine : Si vous utilisez une cigarette électronique plus performante équipée de résistances dont la valeur est inférieure à 1 ohm et pour une puissance supérieure à 30 watts, nous vous conseillons d'utiliser un taux de nicotine plus faible : Conservation de votre e-liquide Pour une conservation optimale de votre e-liquide, nous vous conseillons de stocker votre flacon à l'abri de la lumière dans un droit sec et à température ambiante. Après contacts répétés à l'air et à la lumière, la couleur de votre e-liquide peut se foncer. Ce changement de couleur n'affecte ni la qualité ni le goût de votre e-liquide. La date indiquée sur l'étiquette est une DLUO (date limite d'utilisation optimale) ou DDM (date de durabilité minimale). Passé cette date, le e-liquide peut encore être consommé. Mises en garde et contre-indications : Précautions d'emploi :",VDLV,fruit,"VDLV, pour Vincent Dans Les Vapes, est un fabricant français de liquides pour cigarette électronique. Depuis 2012, la marque basée en Gironde s'attache à proposer des produits de qualité aux vapoteurs du monde entier. Fort de diverses gammes telles que Cirkus, Classic Wanted ou encore V'ICE, VDLV s'adresse autant aux amateurs de e-liquides prêts à vaper qu'aux utilisateurs d'arômes DIY.",52
52,https://www.aromes-et-liquides.fr/e-liquide-hello-cloudy/13256-high-score-200ml.html,High Score 200ml Hello Cloudy,https://assets.aromes-et-liquides.fr/45720-thickbox_default/high-score-200ml.jpg,13.23,200ml,50/50,France,Oui,Oui,"ananas, fraise, lime, raisin","Le High Score, unmélange raisin, d'ananas et de fraises avec une saveur fraîche, dans cette recette de e-liquide à booster par Hello Cloudy. Présenté dans un format de 200ml non nicotiné, vous pouvez au besoin le personnaliser en ajoutant dans sa fiole des boosters 10ml (non inclus). Fabriqué en France, il se compose d'arômes alimentaires, de propylène glycol (PG) et de glycérine végétale (VG), pour un ratio 50PG/50VG. Son flacon de 200ml est équipé d'un bouchon avec sécurité enfant et d'un embout fin. Qui est Hello Cloudy ? Hello Cloudy est un fabricant français de e-liquides pour cigarettes électroniques. Spécialiste des saveurs de fruits, la marque accompagne parfois ses recettes de fraîcheur. Retrouvez les e-liquides Hello Cloudy en format de 200ml à booster, conditionnés dans des flacons équipés d'une ouverture sécurisée et d'un embout fin. Comment préparer votre e-liquide High Score ? Ce e-liquide est proposé en version200mlboostée en arômes. Si vous le souhaitez, vous pouvez ainsi ajouter un ou plusieurs boosters de nicotine selon vos besoins sans perte de saveur. Pour booster votre e-liquide, vous devez : Indications pour préparer votre e-liquide surboosté de 100 ml : La place disponible dans le flacon d'origine n’est peut-être pas suffisante pour booster votre e-liquide au taux de nicotine souhaité. Pour les dosages importants, nous vous conseillons l’utilisation de contenants plus importants commeun flacon de 100ml graduéouun flacon Twist de 230ml gradué. Astuce : pensez à adapter votre matériel au ratio PG/VG de votre e-liquide ! Vous limiterez ainsi le risque de fuite et l’usure prématurée de vos résistances ! Quel taux de nicotine choisir pour votre e-liquide ? Le choix de votre taux de nicotine dépend de votre profil de fumeur ainsi que de la cigarette électronique utilisée : Si vous utilisez du matériel plus performant avec une résistance inférieure à 1 ohm et pour une puissance supérieure à 30 watts, vous pouvez diviser votre taux de nicotine par deux. Nos conseils pour la maturation de votre e-liquide surboosté De la même façon que pour un e-liquide DIY, on peut observer un temps de repos avec un e-liquide surboosté en arômes après l’ajout d’un ou plusieurs boosters de nicotine. Ce temps de maturation que l’on appelle aussi “steep” permet aux arômes de se développer et de mieux s’exprimer. Pour une maturation optimale, il faut compter : Pour un rendu optimal : secouez votre fiole de e-liquide une fois par jour pour que les arômes se diffusent correctement. Conservation de votre e-liquide Pour une conservation optimale de votre e-liquide, nous vous conseillons de stocker votre flacon à l'abri de la lumière dans un droit sec et à température ambiante. Après contacts répétés à l'air et à la lumière, la couleur de votre e-liquide peut se foncer. Ce changement de couleur n'affecte ni la qualité ni le goût de votre e-liquide. La date indiquée sur l'étiquette est une DLUO (date limite d'utilisation optimale) ou DDM (date de durabilité minimale). Passé cette date, le e-liquide peut encore être consommé.",Hello Cloudy,fruit,"Hello Cloudy est un fabricant français de e-liquides pour cigarettes électroniques. Spécialiste des saveurs de fruits, la marque accompagne parfois ses recettes de fraîcheur. Retrouvez les e-liquides Hello Cloudy en format de 200ml à booster, conditionnés dans des flacons équipés d'une ouverture sécurisée et d'un embout fin. ",53
53,https://www.aromes-et-liquides.fr/e-liquide-ultimate/13002-ultimate-phoenix-al-50-ml.html,Phoenix 50ml Ultimate A&L,https://assets.aromes-et-liquides.fr/47776-thickbox_default/ultimate-phoenix-al-50-ml.jpg,18.9,50ml (fiole de 60ml),50/50,France,Oui,Oui,"ananas, lime, citron","Le Phoenix est un e-liquide pour cigarette électronique de chez A&L Ultimate. Il reprend larecette fruitée fraichedu concentré Phoenix, mais présenté ici en e liquide surboosté de 50ml. Contrairement à sa version DIY, vous pourrez l'utiliser immédiatement, en l'état, ou l'accompagner d'un booster de nicotine pour un résultat en 3mg/ml. Qu'est-ce que le e-liquide Ultimate Phoenix 50ml ? Le Phoenix est un e liquide 50ml appelé« à booster ». Ce type de produit permet de profiter d'un grand volume de e-liquide prêt à vaper, et ce, au format nicotiné ou non. De base, votre e-liquide Ultimate Phoenix vous est présenté en 50ml non nicotiné (0mg). Mais, grâce à sa fiole de type PET 60ml, il pourra accueillir jusqu'à un booster de nicotine maximum, pour un taux final en 3mg/ml. Construite sur la même base fraiche de fruits que sa version originelle – l'arôme concentré Phoenixen Sweet/Original Edition – vous retrouverez son assemblage d'ananas et de citron. Et, bien sûr, vous profiterez toujours de la qualité premium d'A&L Ultimate, avec un produit entièrement imaginé et fabriqué en France. Pourquoi choisir le Phoenix en e-liquide 50ml ? Si, pour vous, le mot « vape » devrait toujours rimer avec grand format et simplicité, alors vous êtes forcément fait pour adopter un e-liquide surboosté. D'abord, parce que la recette est exactement telle que l'a pensé Arômes et Liquides. Le dosage est optimal, l'équilibre aromatique est respecté. Ensuite, parce que son format vous assure la tranquillité. Vous n'aurez pas besoin de d'ustensiles ni d'ingrédients pour le vapoter ! Son flacon contient pas moins de 50ml de e-liquide, et pourra même aller jusqu'à 60ml en 3 mg/ml de nicotine (Booster non inclus). Comment utiliser le e liquide Phoenix en 50ml ? C'est simple. Avec le e-liquide Ultimate Phoenix en 50ml par A&L, vous n'aurez qu'une question à vous poser : Vais-je vapoter avec, ou sans nicotine ? À partir de là, vous saurez alors quelle démarche adopter. La préparation sans nicotine Si vous n'avez désormais plus besoin de nicotine, vous pourrez utiliser immédiatement le e-liquide Phoenix : La préparation avec nicotine Du fait de son format de 50ml en fiole de 60ml, le e-liquide Phoenix Ultimate sera en mesure d'accueillir un booster de nicotine maximum (non fourni). L'ajout de ce booster vous permettra d'atteindre 60ml de e-liquide en 3 mg/ml. Pour cela : Attention, le flacon du e-liquide Ultimate Phoenix est seulement adapté à l'ajout d'un booster de nicotine. Pour un taux nicotinique supérieur à 3 mg/ml, vous aurez besoin d'un autre contenant. N.B : Cette étape de préparation peut aussi être effectuée avec un booster en sel de nicotine ou au CBD. La maturation En tant que e-liquide prêt à vaper, le Phoenix Ultimate ne demande pas de temps de maturation (ou steep). Néanmoins, si vous avez décidé de lui ajouter un booster de nicotine pour atteindre les 3 mg/ml, vous pourrez le mettre au repos 2 jours environ (48 heures seulement), afin que ses arômes se mélangent bien. À qui s'adresse le e-liquide Phoenix Ultimate 50ml ? Tout vapoteurpourra être convaincu par les saveurs fraiches de fruits du e-liquide Phoenix Ultimate de chez A&L. C'est au niveau de son format que le e-liquide Phoenix Ultimate se démarquera. Son format prêt à l'emploi le destine aux débutants comme aux vapoteurs qui veulent se faciliter la vape. Enfin, son contenant de 60ml assure à tous ceux qui le souhaitent une importante autonomie en e-liquide. De quoi est composé le e liquide Phoenix en 50ml ? Parce qu'il esttotalement imaginé, puis créé, puis conditionné en France, le e-liquide Ultimate Phoenix respecte, à la lettre, les diverses normes françaises comme européennes. Vous vous assurez donc un produit de la vape fiable, contrôlé et de qualité. Arômes et Liquides est là à chaque étape de sa fabrication, pour encadrer et superviser. En plus d'être minutieusement conforme à toutes les normes en vigueur, le e-liquide Phoenix ne repose que sur des ingrédients de qualité : des arômes alimentaires, du propylène glycol et de la glycérine végétale. Il ne présente aucun diacétyle. Il n'est pas testé sur des animaux. Avec un ratio PG/VG de 50/50, le Phoenix Ultimate en 50ml se veut le plus équilibré et polyvalent possible. Vous l'utiliserez sur tout type de matériel e-cig, pour un compromis entre saveurs, hit en gorge et vapeur. Dans cette version à booster, le e-liquide Phoenix n'est proposé qu'en fiole de type PET 60ml. Cette dernière présente également un bouchon sécurisé (protection enfant) et un astucieux embout fin (remplissage propre).",Arômes et Liquides (A&L),fruit,"Arômes et Liquides (A&L) est un fabricant français de e-liquides et concentrés DIY depuis 2012. Avec ses laborantins situés non loin de Saint-Étienne dans la Loire, il vous présente une vaste collection de saveurs allant des plus simples aux plus complexes. La marque s'est notamment distinguée dans l'univers de la vape grâce à sa recette classic du Ryan USA de la gamme A&L, puis du mix au goût de fruits rouges Ragnarok de la collection Ultimate. ",54
